uid,table_name,name,data_type,nullable,description
PO_HEADERS_ALL.PO_HEADER_ID,PO_HEADERS_ALL,PO_HEADER_ID,NUMBER,Yes,Document header unique identifier
PO_HEADERS_ALL.CHECKLIST_ID,PO_HEADERS_ALL,CHECKLIST_ID,NUMBER,Yes,Value that uniquely identifies the checklist on a Purchasing Document.
PO_HEADERS_ALL.SCHEDULE_GROUP,PO_HEADERS_ALL,SCHEDULE_GROUP,VARCHAR2,Yes,User-defined value used as a criterion for scheduling order creation
PO_HEADERS_ALL.SIGNATURE_REQUIRED_FLAG,PO_HEADERS_ALL,SIGNATURE_REQUIRED_FLAG,VARCHAR2,Yes,Checkbox to indicate  if signatures are required on the document before it can be opened.
PO_HEADERS_ALL.MODE_OF_TRANSPORT,PO_HEADERS_ALL,MODE_OF_TRANSPORT,VARCHAR2,Yes,"Type of transportation used to ship the product, such as truck, air or boat."
PO_HEADERS_ALL.SERVICE_LEVEL,PO_HEADERS_ALL,SERVICE_LEVEL,VARCHAR2,Yes,Priority of transportation that affects how quickly goods are transported
PO_HEADERS_ALL.BUYER_MANAGED_TRANSPORT_FLAG,PO_HEADERS_ALL,BUYER_MANAGED_TRANSPORT_FLAG,VARCHAR2,Yes,"A flag to indicate that the buying company is responsible for arranging the transportation, from picking up the requested goods to delivering to ship-to locations specified on the order. The value is Y/N."
PO_HEADERS_ALL.BILLTO_BU_ID,PO_HEADERS_ALL,BILLTO_BU_ID,NUMBER,Yes,Bill-to Business Unit unique identifier. This captures the business unit which vouches the supplier invoices received for a purchase order.
PO_HEADERS_ALL.SOLDTO_LE_ID,PO_HEADERS_ALL,SOLDTO_LE_ID,NUMBER,Yes,Sold to Legal Entity unique identifier. Indicates the party which is financially responsible for the purchases on a purchase order.
PO_HEADERS_ALL.DEFAULT_PO_TRADE_ORG_ID,PO_HEADERS_ALL,DEFAULT_PO_TRADE_ORG_ID,NUMBER,Yes,Unique identifier for Purchasing Trade Organization. Purchasing Trade Organization is the inventory organization reporting to the Sold-to Legal Entity identified in a Purchase Order. This organization is used for cost accounting the transactions in the Sold-to Legal Entity.
PO_HEADERS_ALL.ORCHESTRATION_ORDER_FLAG,PO_HEADERS_ALL,ORCHESTRATION_ORDER_FLAG,VARCHAR2,Yes,Indicates whether this purchase order is an orchestrated purchase order.
PO_HEADERS_ALL.AGING_PERIOD_DAYS,PO_HEADERS_ALL,AGING_PERIOD_DAYS,NUMBER,Yes,Indicates the maximum number of days the material may be on consignment. It defaults a value for the same term on the document line. Only positive values are allowed. Applicable only to BPA.
PO_HEADERS_ALL.AGING_ONSET_POINT,PO_HEADERS_ALL,AGING_ONSET_POINT,VARCHAR2,Yes,Indicates the mutually agreed event point at which consigned material begins to age. The possible values are None / Receipt / Shipment. Values from Lookups. Applicable only to BPA.
PO_HEADERS_ALL.CONSUMPTION_ADVICE_FREQUENCY,PO_HEADERS_ALL,CONSUMPTION_ADVICE_FREQUENCY,VARCHAR2,Yes,Indicates the default value of the frequency at which the 'Create Consumption Advice' program will be run for all consumption transactions for consigned inventory purchased under this agreement. It defaults a value for the same term on the document line. The possible values are Daily / Weekly / Monthly. Values from Lookups. Applicable only to BPA.
PO_HEADERS_ALL.CONSUMPTION_ADVICE_SUMMARY,PO_HEADERS_ALL,CONSUMPTION_ADVICE_SUMMARY,VARCHAR2,Yes,Indicates the granularity at which consumption advices will be generated. The possible values are Inventory Organization / Item and Transaction Date / Inventory Organization and Item / Inventory Organization / All Inventory Organizations. Values from Lookups. Applicable only to BPA.
PO_HEADERS_ALL.BILLING_CYCLE_CLOSING_DATE,PO_HEADERS_ALL,BILLING_CYCLE_CLOSING_DATE,DATE,Yes,Field to capture when the current billing period for an agreement ends. This is applicable only for a BPA with consignment terms enabled.
PO_HEADERS_ALL.LAST_BILLED_DATE,PO_HEADERS_ALL,LAST_BILLED_DATE,DATE,Yes,Field to capture when the consumption transaction on the agreement was last billed.
PO_HEADERS_ALL.DEFAULT_CONSIGNMENT_LINE_FLAG,PO_HEADERS_ALL,DEFAULT_CONSIGNMENT_LINE_FLAG,VARCHAR2,Yes,Indicates the default value for the Consignment line attribute on the agreement line. Values: Y/N. Applicable only to BPA.
PO_HEADERS_ALL.PAY_ON_USE_FLAG,PO_HEADERS_ALL,PAY_ON_USE_FLAG,VARCHAR2,Yes,This checkbox will indicate whether self-billing is enabled for consumption of consigned material. Values: Y/N. Applicable only to BPA.
PO_HEADERS_ALL.ACTIVE_VERSION_FLAG,PO_HEADERS_ALL,ACTIVE_VERSION_FLAG,VARCHAR2,Yes,A flag to indicate whether the inital draft or change order of the document is still being processed (i.e incomplete status or in the middle of approval process)
PO_HEADERS_ALL.ACCEPTANCE_WITHIN_DAYS,PO_HEADERS_ALL,ACCEPTANCE_WITHIN_DAYS,NUMBER,Yes,Used for Acknowledge within days
PO_HEADERS_ALL.AMOUNT_RELEASED,PO_HEADERS_ALL,AMOUNT_RELEASED,NUMBER,Yes,Amount released against this agreement - sum of all the approved standard PO amounts
PO_HEADERS_ALL.LAST_RELEASE_DATE,PO_HEADERS_ALL,LAST_RELEASE_DATE,DATE,Yes,Latest date on which a purchase order got implemented against this agreement
PO_HEADERS_ALL.CURRENT_VERSION_ID,PO_HEADERS_ALL,CURRENT_VERSION_ID,NUMBER,Yes,Current version of the Header
PO_HEADERS_ALL.GENERATE_ORDERS_AUTOMATIC,PO_HEADERS_ALL,GENERATE_ORDERS_AUTOMATIC,VARCHAR2,Yes,Automatically Generate Orders flag
PO_HEADERS_ALL.SUBMIT_APPROVAL_AUTOMATIC,PO_HEADERS_ALL,SUBMIT_APPROVAL_AUTOMATIC,VARCHAR2,Yes,Automatically Submit for Approval flag
PO_HEADERS_ALL.GROUP_REQUISITIONS,PO_HEADERS_ALL,GROUP_REQUISITIONS,VARCHAR2,Yes,Group Requisitions flag
PO_HEADERS_ALL.GROUP_REQUISITION_LINES,PO_HEADERS_ALL,GROUP_REQUISITION_LINES,VARCHAR2,Yes,Group Requisition Lines flag
PO_HEADERS_ALL.USE_NEED_BY_DATE,PO_HEADERS_ALL,USE_NEED_BY_DATE,VARCHAR2,Yes,Use need by date falg
PO_HEADERS_ALL.USE_SHIP_TO,PO_HEADERS_ALL,USE_SHIP_TO,VARCHAR2,Yes,Use ship to organization and location flag
PO_HEADERS_ALL.DOCUMENT_STATUS,PO_HEADERS_ALL,DOCUMENT_STATUS,VARCHAR2,Yes,Header status
PO_HEADERS_ALL.PRC_BU_ID,PO_HEADERS_ALL,PRC_BU_ID,NUMBER,Yes,PRC_BU_ID
PO_HEADERS_ALL.REQ_BU_ID,PO_HEADERS_ALL,REQ_BU_ID,NUMBER,Yes,REQ_BU_ID
PO_HEADERS_ALL.DEFAULT_TAXATION_COUNTRY,PO_HEADERS_ALL,DEFAULT_TAXATION_COUNTRY,VARCHAR2,Yes,The country for taxation for tax calculation purposes
PO_HEADERS_ALL.TAX_DOCUMENT_SUBTYPE,PO_HEADERS_ALL,TAX_DOCUMENT_SUBTYPE,VARCHAR2,Yes,Country Specific classification of the document used for tax calculation and reporting putposes
PO_HEADERS_ALL.AGENT_ID,PO_HEADERS_ALL,AGENT_ID,NUMBER,Yes,Buyer unique identifier. (References PO_AGENTS.agent_id)
PO_HEADERS_ALL.TYPE_LOOKUP_CODE,PO_HEADERS_ALL,TYPE_LOOKUP_CODE,VARCHAR2,Yes,Type of the document. (Combined with segment1and bu to form unique key; References PO_DOCUMENT_TYPES_ALL_B.document_subtype)
PO_HEADERS_ALL.LAST_UPDATE_DATE,PO_HEADERS_ALL,LAST_UPDATE_DATE,TIMESTAMP,Yes,Who column: indicates the date and time of the last update of the row.
PO_HEADERS_ALL.LAST_UPDATED_BY,PO_HEADERS_ALL,LAST_UPDATED_BY,VARCHAR2,Yes,Who column: indicates the user who last updated the row.
PO_HEADERS_ALL.SEGMENT1,PO_HEADERS_ALL,SEGMENT1,VARCHAR2,Yes,Key Flexfield: segment of the key flexfield.
PO_HEADERS_ALL.SUMMARY_FLAG,PO_HEADERS_ALL,SUMMARY_FLAG,VARCHAR2,Yes,Key Flexfield summary flag
PO_HEADERS_ALL.CARRIER_ID,PO_HEADERS_ALL,CARRIER_ID,NUMBER,Yes,Carrier ID (Party ID)
PO_HEADERS_ALL.ENABLED_FLAG,PO_HEADERS_ALL,ENABLED_FLAG,VARCHAR2,Yes,Key Flexfield enabled flag
PO_HEADERS_ALL.SEGMENT2,PO_HEADERS_ALL,SEGMENT2,VARCHAR2,Yes,Key Flexfield: segment of the key flexfield.
PO_HEADERS_ALL.SEGMENT3,PO_HEADERS_ALL,SEGMENT3,VARCHAR2,Yes,Key Flexfield: segment of the key flexfield.
PO_HEADERS_ALL.SEGMENT4,PO_HEADERS_ALL,SEGMENT4,VARCHAR2,Yes,Key Flexfield: segment of the key flexfield.
PO_HEADERS_ALL.SEGMENT5,PO_HEADERS_ALL,SEGMENT5,VARCHAR2,Yes,Key Flexfield: segment of the key flexfield.
PO_HEADERS_ALL.LAST_UPDATE_LOGIN,PO_HEADERS_ALL,LAST_UPDATE_LOGIN,VARCHAR2,Yes,Who column: indicates the session login associated to the user who last updated the row.
PO_HEADERS_ALL.CREATION_DATE,PO_HEADERS_ALL,CREATION_DATE,TIMESTAMP,Yes,Who column: indicates the date and time of the creation of the row.
PO_HEADERS_ALL.CREATED_BY,PO_HEADERS_ALL,CREATED_BY,VARCHAR2,Yes,Who column: indicates the user who created the row.
PO_HEADERS_ALL.VENDOR_ID,PO_HEADERS_ALL,VENDOR_ID,NUMBER,Yes,Supplier unique identifier (References PO_VENDORS.vendor_id)
PO_HEADERS_ALL.VENDOR_SITE_ID,PO_HEADERS_ALL,VENDOR_SITE_ID,NUMBER,Yes,Supplier site unique identifier (References PO_VENDOR_SITES_ALL.vendor_site_id)
PO_HEADERS_ALL.VENDOR_CONTACT_ID,PO_HEADERS_ALL,VENDOR_CONTACT_ID,NUMBER,Yes,Supplier contact unique identifier (References PO_VENDOR_CONTACTS.vendor_contact_id)
PO_HEADERS_ALL.SHIP_TO_LOCATION_ID,PO_HEADERS_ALL,SHIP_TO_LOCATION_ID,NUMBER,Yes,Ship-to location unique identifier (References HR_LOCATIONS_ALL.location_id)
PO_HEADERS_ALL.BILL_TO_LOCATION_ID,PO_HEADERS_ALL,BILL_TO_LOCATION_ID,NUMBER,Yes,Bill-to location unique identifier (References HR_LOCATIONS_ALL.location_id)
PO_HEADERS_ALL.TERMS_ID,PO_HEADERS_ALL,TERMS_ID,NUMBER,Yes,Payment terms unique identifier (References to AP_TERMS_TL.term_id)
PO_HEADERS_ALL.FOB_LOOKUP_CODE,PO_HEADERS_ALL,FOB_LOOKUP_CODE,VARCHAR2,Yes,Type of free-on-board terms for the document (References PO_LOOKUP_CODES.lookup_code with LOOKUP_TYPE='FOB')
PO_HEADERS_ALL.FREIGHT_TERMS_LOOKUP_CODE,PO_HEADERS_ALL,FREIGHT_TERMS_LOOKUP_CODE,VARCHAR2,Yes,Type of freight terms for the document (References PO_LOOKUP_CODES.lookup_code with LOOKUP_TYPE='FREIGHT TERMS')
PO_HEADERS_ALL.CURRENCY_CODE,PO_HEADERS_ALL,CURRENCY_CODE,VARCHAR2,Yes,Unique identifier for the currency (References FND_CURRENCIES.currency_code)
PO_HEADERS_ALL.RATE_TYPE,PO_HEADERS_ALL,RATE_TYPE,VARCHAR2,Yes,Currency conversion rate type (References GL_DAILY_CONVERSION_TYPES.conversion_type)
PO_HEADERS_ALL.RATE_DATE,PO_HEADERS_ALL,RATE_DATE,DATE,Yes,Currency conversion date
PO_HEADERS_ALL.RATE,PO_HEADERS_ALL,RATE,NUMBER,Yes,Currency conversion rate
PO_HEADERS_ALL.FROM_HEADER_ID,PO_HEADERS_ALL,FROM_HEADER_ID,NUMBER,Yes,Unique identifier of document from which this document is copied (References PO_HEADERS_ALL.po_header_id)
PO_HEADERS_ALL.FROM_TYPE_LOOKUP_CODE,PO_HEADERS_ALL,FROM_TYPE_LOOKUP_CODE,VARCHAR2,Yes,Document type of the document used to copy or autocreate another document (References: PO_DOCUMENT_TYPES_ALL_B.document_subtype)
PO_HEADERS_ALL.START_DATE,PO_HEADERS_ALL,START_DATE,DATE,Yes,Effective date of the document
PO_HEADERS_ALL.END_DATE,PO_HEADERS_ALL,END_DATE,DATE,Yes,Expiration date of the document
PO_HEADERS_ALL.BLANKET_TOTAL_AMOUNT,PO_HEADERS_ALL,BLANKET_TOTAL_AMOUNT,NUMBER,Yes,Amount agreed for the planned or blanket purchase order
PO_HEADERS_ALL.REVISION_NUM,PO_HEADERS_ALL,REVISION_NUM,NUMBER,Yes,Document revision number
PO_HEADERS_ALL.REVISED_DATE,PO_HEADERS_ALL,REVISED_DATE,DATE,Yes,Date the document was last revised
PO_HEADERS_ALL.APPROVED_FLAG,PO_HEADERS_ALL,APPROVED_FLAG,VARCHAR2,Yes,Indicates whether the purchase order is approved or not
PO_HEADERS_ALL.APPROVED_DATE,PO_HEADERS_ALL,APPROVED_DATE,DATE,Yes,Date the purchase order was last approved
PO_HEADERS_ALL.AMOUNT_LIMIT,PO_HEADERS_ALL,AMOUNT_LIMIT,NUMBER,Yes,"Blanket, Planned PO or Contract only: Maximum amount that can be released"
PO_HEADERS_ALL.MIN_RELEASE_AMOUNT,PO_HEADERS_ALL,MIN_RELEASE_AMOUNT,NUMBER,Yes,Minimum amount that can be released against a blanket or planned purchase order
PO_HEADERS_ALL.NOTE_TO_AUTHORIZER,PO_HEADERS_ALL,NOTE_TO_AUTHORIZER,VARCHAR2,Yes,Not currently used
PO_HEADERS_ALL.NOTE_TO_VENDOR,PO_HEADERS_ALL,NOTE_TO_VENDOR,VARCHAR2,Yes,Note to the supplier
PO_HEADERS_ALL.NOTE_TO_RECEIVER,PO_HEADERS_ALL,NOTE_TO_RECEIVER,VARCHAR2,Yes,Note to the receiver of the purchase order
PO_HEADERS_ALL.VENDOR_ORDER_NUM,PO_HEADERS_ALL,VENDOR_ORDER_NUM,VARCHAR2,Yes,"Indicates supplier document number, it gets copied from PO_HEADERS_INTERFACE.vendor_doc_num"
PO_HEADERS_ALL.CONFIRMING_ORDER_FLAG,PO_HEADERS_ALL,CONFIRMING_ORDER_FLAG,VARCHAR2,Yes,Indicates whether the purchase order is a confirming order or not
PO_HEADERS_ALL.COMMENTS,PO_HEADERS_ALL,COMMENTS,VARCHAR2,Yes,Descriptive comments for the document
PO_HEADERS_ALL.ACCEPTANCE_REQUIRED_FLAG,PO_HEADERS_ALL,ACCEPTANCE_REQUIRED_FLAG,VARCHAR2,Yes,Indicates whether acceptance from the supplier is required or not
PO_HEADERS_ALL.ACCEPTANCE_DUE_DATE,PO_HEADERS_ALL,ACCEPTANCE_DUE_DATE,DATE,Yes,Date by which the supplier should accept the purchase order
PO_HEADERS_ALL.CLOSED_DATE,PO_HEADERS_ALL,CLOSED_DATE,DATE,Yes,Date the document was closed
PO_HEADERS_ALL.CANCEL_FLAG,PO_HEADERS_ALL,CANCEL_FLAG,VARCHAR2,Yes,Indicates whether the purchase order is cancelled or not
PO_HEADERS_ALL.FIRM_STATUS_LOOKUP_CODE,PO_HEADERS_ALL,FIRM_STATUS_LOOKUP_CODE,VARCHAR2,Yes,Indicates whether you want to prevent this purchase order from being automatically rescheduled by your manufacturing application
PO_HEADERS_ALL.FIRM_DATE,PO_HEADERS_ALL,FIRM_DATE,DATE,Yes,Date from which the purchase order is firmed
PO_HEADERS_ALL.FROZEN_FLAG,PO_HEADERS_ALL,FROZEN_FLAG,VARCHAR2,Yes,Indicates whether the document is frozen or not
PO_HEADERS_ALL.EDI_PROCESSED_FLAG,PO_HEADERS_ALL,EDI_PROCESSED_FLAG,VARCHAR2,Yes,EDI processed flag
PO_HEADERS_ALL.EDI_PROCESSED_STATUS,PO_HEADERS_ALL,EDI_PROCESSED_STATUS,VARCHAR2,Yes,EDI processing status flag
PO_HEADERS_ALL.GOVERNMENT_CONTEXT,PO_HEADERS_ALL,GOVERNMENT_CONTEXT,VARCHAR2,Yes,USSGL descriptive flexfield context column
PO_HEADERS_ALL.REQUEST_ID,PO_HEADERS_ALL,REQUEST_ID,NUMBER,Yes,Enterprise Service Scheduler: indicates the request ID of the job that created or last updated the row.
PO_HEADERS_ALL.JOB_DEFINITION_NAME,PO_HEADERS_ALL,JOB_DEFINITION_NAME,VARCHAR2,Yes,Enterprise Service Scheduler: indicates the name of the job that created or last updated the row.
PO_HEADERS_ALL.JOB_DEFINITION_PACKAGE,PO_HEADERS_ALL,JOB_DEFINITION_PACKAGE,VARCHAR2,Yes,Enterprise Service Scheduler: indicates the package name of the job that created or last updated the row.
PO_HEADERS_ALL.PROGRAM_NAME,PO_HEADERS_ALL,PROGRAM_NAME,VARCHAR2,Yes,PROGRAM_NAME
PO_HEADERS_ALL.PROGRAM_APP_NAME,PO_HEADERS_ALL,PROGRAM_APP_NAME,VARCHAR2,Yes,PROGRAM_APP_NAME
PO_HEADERS_ALL.SOLDTO_BU_ID,PO_HEADERS_ALL,SOLDTO_BU_ID,NUMBER,Yes,Sold to Business Unit Unique Identifier
PO_HEADERS_ALL.INTERFACE_SOURCE_CODE,PO_HEADERS_ALL,INTERFACE_SOURCE_CODE,VARCHAR2,Yes,Identifier for upstream integrating module. Reserved for internal use.
PO_HEADERS_ALL.REFERENCE_NUM,PO_HEADERS_ALL,REFERENCE_NUM,VARCHAR2,Yes,Audit trail reference (needed for 832 EDI transaction)
PO_HEADERS_ALL.PCARD_ID,PO_HEADERS_ALL,PCARD_ID,NUMBER,Yes,Unique identifer for the procurement card used for the order (References AP_CARDS_ALL.card_id)
PO_HEADERS_ALL.PRICE_UPDATE_TOLERANCE,PO_HEADERS_ALL,PRICE_UPDATE_TOLERANCE,NUMBER,Yes,Maximum percentage increase allowed in price/sales catalog update (832 EDI transaction) sent by supplier
PO_HEADERS_ALL.PAY_ON_CODE,PO_HEADERS_ALL,PAY_ON_CODE,VARCHAR2,Yes,Indicator of whether the purchase order will be paid upon receipt (References PO_LOOKUP_CODES.lookup_code with LOOKUP_TYPE='PAY ON CODE')
PO_HEADERS_ALL.XML_FLAG,PO_HEADERS_ALL,XML_FLAG,VARCHAR2,Yes,Indicator whether the delivery option is through XML.  Y if so.
PO_HEADERS_ALL.XML_SEND_DATE,PO_HEADERS_ALL,XML_SEND_DATE,DATE,Yes,"Date on which XML document is created, if XML delivery is used."
PO_HEADERS_ALL.XML_CHANGE_SEND_DATE,PO_HEADERS_ALL,XML_CHANGE_SEND_DATE,DATE,Yes,"Date on which the po change XML document generation date, if delivery option is XML."
PO_HEADERS_ALL.CONSIGNED_CONSUMPTION_FLAG,PO_HEADERS_ALL,CONSIGNED_CONSUMPTION_FLAG,VARCHAR2,Yes,Flag  indicates that  the purchase order is a consumption advice
PO_HEADERS_ALL.CBC_ACCOUNTING_DATE,PO_HEADERS_ALL,CBC_ACCOUNTING_DATE,DATE,Yes,Column used to store the accounting action date for dual budgetary control functionality.
PO_HEADERS_ALL.CONSUME_REQ_DEMAND_FLAG,PO_HEADERS_ALL,CONSUME_REQ_DEMAND_FLAG,VARCHAR2,Yes,Used by Oracle Sourcing- Tells whether user wanted to consume the req demand when creating a blanket
PO_HEADERS_ALL.CHANGE_REQUESTED_BY,PO_HEADERS_ALL,CHANGE_REQUESTED_BY,VARCHAR2,Yes,Change Requested By will track changes to Purchase Document from Supplier/ Requester
PO_HEADERS_ALL.SHIPPING_CONTROL,PO_HEADERS_ALL,SHIPPING_CONTROL,VARCHAR2,Yes,Indicator of who is responsible for arranging transportation (References PO_LOOKUP_CODES.lookup_code with LOOKUP_TYPE='SHIPPING CONTROL')
PO_HEADERS_ALL.CONTERMS_EXIST_FLAG,PO_HEADERS_ALL,CONTERMS_EXIST_FLAG,VARCHAR2,Yes,"Indicates if contract terms template is attached to the purchasing document or not. Applicable to Purchasing document of type Standard, Contract, Blanket"
PO_HEADERS_ALL.CONTERMS_ARTICLES_UPD_DATE,PO_HEADERS_ALL,CONTERMS_ARTICLES_UPD_DATE,DATE,Yes,"Timestamp for the last update to Contract Clauses.  Applicable to Purchasing document of type Standard, Contract, Blanket"
PO_HEADERS_ALL.CONTERMS_DELIV_UPD_DATE,PO_HEADERS_ALL,CONTERMS_DELIV_UPD_DATE,DATE,Yes,"Timestamp for the last update to Contract Deliverables. Applicable to Purchasing document of type Standard, Contract, Blanket"
PO_HEADERS_ALL.PENDING_SIGNATURE_FLAG,PO_HEADERS_ALL,PENDING_SIGNATURE_FLAG,VARCHAR2,Yes,"Indicates if the purchasing document is waiting for the signatures or not. Applicable to Purchasing document of type Standard, Contract, Blanket"
PO_HEADERS_ALL.CHANGE_SUMMARY,PO_HEADERS_ALL,CHANGE_SUMMARY,VARCHAR2,Yes,Description of changes made. This information is entered by the Buyer when submitting the document for approval and may be used in generating an amendment document.
PO_HEADERS_ALL.ENCUMBRANCE_REQUIRED_FLAG,PO_HEADERS_ALL,ENCUMBRANCE_REQUIRED_FLAG,VARCHAR2,Yes,Blanket or Global Agreement only: Indicates whether the document is to be encumbred or not
PO_HEADERS_ALL.DOCUMENT_CREATION_METHOD,PO_HEADERS_ALL,DOCUMENT_CREATION_METHOD,VARCHAR2,Yes,"Method in which the document got created - Autocreate, enter PO , etc..."
PO_HEADERS_ALL.SUBMIT_DATE,PO_HEADERS_ALL,SUBMIT_DATE,DATE,Yes,Date when document was first submitted for approval
PO_HEADERS_ALL.SUPPLIER_NOTIF_METHOD,PO_HEADERS_ALL,SUPPLIER_NOTIF_METHOD,VARCHAR2,Yes,Supplier Notification Method
PO_HEADERS_ALL.FAX,PO_HEADERS_ALL,FAX,VARCHAR2,Yes,Supplier Fax Number
PO_HEADERS_ALL.EMAIL_ADDRESS,PO_HEADERS_ALL,EMAIL_ADDRESS,VARCHAR2,Yes,Email address of the supplier for communication
PO_HEADERS_ALL.USE_ORDER_DATE_IN_PRICING_FLAG,PO_HEADERS_ALL,USE_ORDER_DATE_IN_PRICING_FLAG,VARCHAR2,Yes,This flag on the agreement indicates whether or not the order date should be used to derive price on the orders referencing the agreement
PO_HEADERS_ALL.RETRO_PRICE_COMM_UPDATES_FLAG,PO_HEADERS_ALL,RETRO_PRICE_COMM_UPDATES_FLAG,VARCHAR2,Yes,This flag on the agreement indicates whether or not orders that were repriced because of a price change on the referenced agreement should be communicated to the supplier.
PO_HEADERS_ALL.RETRO_PRICE_APPLY_UPDATES_FLAG,PO_HEADERS_ALL,RETRO_PRICE_APPLY_UPDATES_FLAG,VARCHAR2,Yes,This flag on the agreement indicates whether or not price updates on the agreement should be propagated to orders referencing the agreement.
PO_HEADERS_ALL.UPDATE_SOURCING_RULES_FLAG,PO_HEADERS_ALL,UPDATE_SOURCING_RULES_FLAG,VARCHAR2,Yes,Update sourcing rules flag
PO_HEADERS_ALL.AUTO_SOURCING_FLAG,PO_HEADERS_ALL,AUTO_SOURCING_FLAG,VARCHAR2,Yes,Enable automatic sourcing flag
PO_HEADERS_ALL.CREATED_LANGUAGE,PO_HEADERS_ALL,CREATED_LANGUAGE,VARCHAR2,Yes,Language code in which the GBPA was created.
PO_HEADERS_ALL.CPA_REFERENCE,PO_HEADERS_ALL,CPA_REFERENCE,NUMBER,Yes,This is to support the iP catalog upgrade for items that had a CPA reference prior to Release 12. This column is just for information purpose.
PO_HEADERS_ALL.STYLE_ID,PO_HEADERS_ALL,STYLE_ID,NUMBER,Yes,Determines the Purchasing Style of the document.
PO_HEADERS_ALL.LAST_UPDATED_PROGRAM,PO_HEADERS_ALL,LAST_UPDATED_PROGRAM,VARCHAR2,Yes,The program name that last updated the row.
PO_HEADERS_ALL.CAT_ADMIN_AUTH_ENABLED_FLAG,PO_HEADERS_ALL,CAT_ADMIN_AUTH_ENABLED_FLAG,VARCHAR2,Yes,Cat Admin Auth Enabled Flag
PO_HEADERS_ALL.RELEASE_METHOD,PO_HEADERS_ALL,RELEASE_METHOD,VARCHAR2,Yes,Release Method for ASL creation (Only for PA)
PO_HEADERS_ALL.REVIEW_AUTOGENERATED_RELEASES,PO_HEADERS_ALL,REVIEW_AUTOGENERATED_RELEASES,VARCHAR2,Yes,Review Autogenerated Releases(Only for PA)
PO_HEADERS_ALL.OBJECT_VERSION_NUMBER,PO_HEADERS_ALL,OBJECT_VERSION_NUMBER,NUMBER,Yes,Used to implement optimistic locking. This number is incremented every time that the row is updated. The number is compared at the start and end of a transaction to detect whether another session has updated the row since it was queried.
PO_HEADERS_ALL.MERGE_REQUEST_ID,PO_HEADERS_ALL,MERGE_REQUEST_ID,NUMBER,Yes,Merge Request ID Unique Identifier(References POZ_SUPPLIER_MERGE_REQUESTS.merge_request_id)
PO_HEADERS_ALL.USE_SALES_ORDER_NUMBER_FLAG,PO_HEADERS_ALL,USE_SALES_ORDER_NUMBER_FLAG,VARCHAR2,Yes,Indicates whether requisition lines should be grouped by Sales Order Number to create distinct purchase order.
PO_HEADERS_ALL.FUNDS_STATUS,PO_HEADERS_ALL,FUNDS_STATUS,VARCHAR2,Yes,status to indicate whether funds have been reserved on the document or not
PO_HEADERS_ALL.FIRST_PTY_REG_ID,PO_HEADERS_ALL,FIRST_PTY_REG_ID,NUMBER,Yes,First Party Tax Registration ID for the transaction.
PO_HEADERS_ALL.THIRD_PTY_REG_ID,PO_HEADERS_ALL,THIRD_PTY_REG_ID,NUMBER,Yes,Third Party Tax Registration ID for the transaction.
PO_HEADERS_ALL.DISABLE_AUTOSOURCING_FLAG,PO_HEADERS_ALL,DISABLE_AUTOSOURCING_FLAG,VARCHAR2,Yes,Disable Automatic Sourcing Flag
PO_HEADERS_ALL.PUNCHOUT_SOURCING_ONLY_FLAG,PO_HEADERS_ALL,PUNCHOUT_SOURCING_ONLY_FLAG,VARCHAR2,Yes,Automatic Sourcing of Punchout Requests Only
PO_HEADERS_ALL.BUDGET_CONTROL_ENABLED_FLAG,PO_HEADERS_ALL,BUDGET_CONTROL_ENABLED_FLAG,VARCHAR2,Yes,Flag to indicate if Budgetary conrol was enabled at the time of Purchase Order creation. Not applicable to Agreements.
PO_HEADERS_ALL.RETRO_PRICE_OPEN_ORDER_FLAG,PO_HEADERS_ALL,RETRO_PRICE_OPEN_ORDER_FLAG,VARCHAR2,Yes,This flag on the agreement indicates whether or not the retroactive price update background process should only reprice open unfulfilled orders referencing the agreement.
PO_HEADERS_ALL.RETRO_PRICE_INIT_APPROVAL_FLAG,PO_HEADERS_ALL,RETRO_PRICE_INIT_APPROVAL_FLAG,VARCHAR2,Yes,This flag on the agreement indicates whether or not the retroactive price update background process should be initiated upon agreement approval.
PO_HEADERS_ALL.REBUILD_INDEX,PO_HEADERS_ALL,REBUILD_INDEX,VARCHAR2,Yes,This column has an oracle text domain index defined to support keyword search.
PO_HEADERS_ALL.REFRESH_INDEX,PO_HEADERS_ALL,REFRESH_INDEX,VARCHAR2,Yes,"This column is updated anytime new document is created or an existing one is changed. Based on update to this column value, REBUILD INDEX is updated via ESS."
PO_HEADERS_ALL.ALLOW_MULTIPLE_SITES_FLAG,PO_HEADERS_ALL,ALLOW_MULTIPLE_SITES_FLAG,VARCHAR2,Yes,A flag to indicate that an agreement can be used across all supplier sites for a given supplier.
PO_HEADERS_ALL.USE_SHIP_TO_FOR_GROUP_REQS,PO_HEADERS_ALL,USE_SHIP_TO_FOR_GROUP_REQS,VARCHAR2,Yes,Checkbox to indicate whether to use ship-to organization and location when grouping requisitions
PO_HEADERS_ALL.MASTER_CONTRACT_ID,PO_HEADERS_ALL,MASTER_CONTRACT_ID,NUMBER,Yes,"The Master Contract Identifier. The master contract refers to the general contract that primarily serves to set the terms and conditions between parties at a high level that govern subsequent, more specific, contractual agreements."
PO_HEADERS_ALL.CC_EMAIL_ADDRESS,PO_HEADERS_ALL,CC_EMAIL_ADDRESS,VARCHAR2,Yes,Email address to which a copy of the email is sent
PO_HEADERS_ALL.BCC_EMAIL_ADDRESS,PO_HEADERS_ALL,BCC_EMAIL_ADDRESS,VARCHAR2,Yes,Email address to which a copy of the email is sent without letting other recipients know
PO_HEADERS_ALL.OVERRIDING_APPROVER_ID,PO_HEADERS_ALL,OVERRIDING_APPROVER_ID,NUMBER,Yes,Overriding approver on purchase orders and change orders for approval routing.
PO_HEADERS_ALL.SKIP_ELECTRONIC_COMM_FLAG,PO_HEADERS_ALL,SKIP_ELECTRONIC_COMM_FLAG,VARCHAR2,Yes,Indicates whether electronic communication should be skipped
PO_HEADERS_ALL.ALT_CONTACT_EMAIL_ADDRESS,PO_HEADERS_ALL,ALT_CONTACT_EMAIL_ADDRESS,VARCHAR2,Yes,Alternate Supplier Contact Email address of the supplier for communication
PO_HEADERS_ALL.SOURCING_PRIORITY,PO_HEADERS_ALL,SOURCING_PRIORITY,NUMBER,Yes,Indicates the numerical value to determine the sourcing priority. Applicable only to BPA.
PO_HEADERS_ALL.SPECIAL_HANDLING_TYPE_CODE,PO_HEADERS_ALL,SPECIAL_HANDLING_TYPE_CODE,VARCHAR2,Yes,Special Handling Descriptive Flexfield: segment of the special handling descriptive flexfield.
PO_HEADERS_ALL.po_headers_all,PO_HEADERS_ALL,po_headers_all,AGREEMENT_ID,Yes,Indexes
PO_HEADERS_ALL.Default,PO_HEADERS_ALL,Default,REBUILD_INDEX,Yes,
PO_LINES_ALL.PO_LINE_ID,PO_LINES_ALL,PO_LINE_ID,NUMBER,Yes,Document line unique identifier
PO_LINES_ALL.DISCOUNT_TYPE,PO_LINES_ALL,DISCOUNT_TYPE,VARCHAR2,Yes,Type that indicates whether the discount is based on percent or amount
PO_LINES_ALL.DISCOUNT,PO_LINES_ALL,DISCOUNT,NUMBER,Yes,Value which indicates the discount percent or amount of the purchase order line
PO_LINES_ALL.DISCOUNT_REASON,PO_LINES_ALL,DISCOUNT_REASON,VARCHAR2,Yes,Description of the reason for the discount
PO_LINES_ALL.LIST_PRICE,PO_LINES_ALL,LIST_PRICE,NUMBER,Yes,The original price per unit of the item or service offered
PO_LINES_ALL.FUNDS_STATUS,PO_LINES_ALL,FUNDS_STATUS,VARCHAR2,Yes,Indicates whether the line amount is reserved or not
PO_LINES_ALL.CONFIGURED_ITEM_FLAG,PO_LINES_ALL,CONFIGURED_ITEM_FLAG,VARCHAR2,Yes,"(PO Only, CTO Only) Flag to indicate whether document should support model items and options."
