uid,table_name,name,data_type,nullable,description
PO_DISTRIBUTIONS_ALL.WIP_OPERATION_SEQ_NUM,PO_DISTRIBUTIONS_ALL,WIP_OPERATION_SEQ_NUM,NUMBER,Yes,"WIP operation sequence number within a routing. Combined with WIP_ENTITY_ID, DESTINATION_ORGANIZATION_ID, WIP_REPETITIVE_SCHEDULE_ID, forms a foreign key to WIP_OPERATIONS. Combined with WIP_ENTITY_ID, DESTINATION_ORGANIZATION_ID, WIP_RESOURCE_SEQ_NUM, and WIP_REPETITIVE_SCHEDULE_ID, forms a foreign key to WIP_OPERATION_RESOURCES."
PO_DISTRIBUTIONS_ALL.WIP_RESOURCE_SEQ_NUM,PO_DISTRIBUTIONS_ALL,WIP_RESOURCE_SEQ_NUM,NUMBER,Yes,"WIP resource sequence number. Combined with WIP_ENTITY_ID, DESTINATION_ORGANIZATION_ID, WIP_OPERATION_SEQ_NUM, and WIP_REPETITIVE_SCHEDULE_ID, forms a foreign key to WIP_OPERATION_RESOURCES."
PO_DISTRIBUTIONS_ALL.WIP_REPETITIVE_SCHEDULE_ID,PO_DISTRIBUTIONS_ALL,WIP_REPETITIVE_SCHEDULE_ID,NUMBER,Yes,"WIP repetitive schedule identifier. Combined with WIP_ENTITY_ID, DESTINATION_ORGANIZATION_ID, and WIP_OPERATION_SEQ_NUM, forms a foreign key to WIP_OPERATIONS. Combined with WIP_ENTITY_ID, DESTINATION_ORGANIZATION_ID, WIP_OPERATION_SEQ_NUM, and WIP_RESOURCE_SEQ_NUM, forms a foreign key to WIP_OPERATION_RESOURCES."
PO_DISTRIBUTIONS_ALL.WIP_LINE_ID,PO_DISTRIBUTIONS_ALL,WIP_LINE_ID,NUMBER,Yes,"WIP line identifier. Combined with DESTINATION_ORGANIZATION_ID, forms a foreign key to WIP_LINES."
PO_DISTRIBUTIONS_ALL.BOM_RESOURCE_ID,PO_DISTRIBUTIONS_ALL,BOM_RESOURCE_ID,NUMBER,Yes,BOM resource unique identifier. References BOM_RESOURCES.RESOURCE_ID.
PO_DISTRIBUTIONS_ALL.BUDGET_ACCOUNT_ID,PO_DISTRIBUTIONS_ALL,BUDGET_ACCOUNT_ID,NUMBER,Yes,Unique identifier for the General Ledger budget account. References GL_CODE_COMBINATIONS.CODE_COMBINATION_ID.
PO_DISTRIBUTIONS_ALL.ACCRUAL_ACCOUNT_ID,PO_DISTRIBUTIONS_ALL,ACCRUAL_ACCOUNT_ID,NUMBER,Yes,Unique identifier for the General Ledger accrual account. References GL_CODE_COMBINATIONS.CODE_COMBINATION_ID.
PO_DISTRIBUTIONS_ALL.VARIANCE_ACCOUNT_ID,PO_DISTRIBUTIONS_ALL,VARIANCE_ACCOUNT_ID,NUMBER,Yes,Unique identifier for the General Ledger variance account. References GL_CODE_COMBINATIONS.CODE_COMBINATION_ID.
PO_DISTRIBUTIONS_ALL.PREVENT_ENCUMBRANCE_FLAG,PO_DISTRIBUTIONS_ALL,PREVENT_ENCUMBRANCE_FLAG,VARCHAR2,Yes,Indicates whether distribution should be encumbered
PO_DISTRIBUTIONS_ALL.GOVERNMENT_CONTEXT,PO_DISTRIBUTIONS_ALL,GOVERNMENT_CONTEXT,VARCHAR2,Yes,USSGL descriptive flexfield context column
PO_DISTRIBUTIONS_ALL.DESTINATION_CONTEXT,PO_DISTRIBUTIONS_ALL,DESTINATION_CONTEXT,VARCHAR2,Yes,Protected descriptive flexfield context column for destination details
PO_DISTRIBUTIONS_ALL.DISTRIBUTION_NUM,PO_DISTRIBUTIONS_ALL,DISTRIBUTION_NUM,NUMBER,Yes,Distribution number
PO_DISTRIBUTIONS_ALL.SOURCE_DISTRIBUTION_ID,PO_DISTRIBUTIONS_ALL,SOURCE_DISTRIBUTION_ID,NUMBER,Yes,Unique identifier of the planned purchase order distribution that was referenced when creating this scheduled release distribution. References PO_DISTRIBUTIONS_ALL.PO_DISTRIBUTION_ID.
PO_DISTRIBUTIONS_ALL.REQUEST_ID,PO_DISTRIBUTIONS_ALL,REQUEST_ID,NUMBER,Yes,Enterprise Service Scheduler: indicates the request ID of the job that created or last updated the row.
PO_DISTRIBUTIONS_ALL.JOB_DEFINITION_NAME,PO_DISTRIBUTIONS_ALL,JOB_DEFINITION_NAME,VARCHAR2,Yes,Enterprise Service Scheduler: indicates the name of the job that created or last updated the row.
PO_DISTRIBUTIONS_ALL.JOB_DEFINITION_PACKAGE,PO_DISTRIBUTIONS_ALL,JOB_DEFINITION_PACKAGE,VARCHAR2,Yes,Enterprise Service Scheduler: indicates the package name of the job that created or last updated the row.
PO_DISTRIBUTIONS_ALL.PROGRAM_NAME,PO_DISTRIBUTIONS_ALL,PROGRAM_NAME,VARCHAR2,Yes,PROGRAM_NAME
PO_DISTRIBUTIONS_ALL.PROGRAM_APP_NAME,PO_DISTRIBUTIONS_ALL,PROGRAM_APP_NAME,VARCHAR2,Yes,PROGRAM_APP_NAME
PO_DISTRIBUTIONS_ALL.GL_CLOSED_DATE,PO_DISTRIBUTIONS_ALL,GL_CLOSED_DATE,DATE,Yes,Date the distribution was final-closed
PO_DISTRIBUTIONS_ALL.ACCRUE_ON_RECEIPT_FLAG,PO_DISTRIBUTIONS_ALL,ACCRUE_ON_RECEIPT_FLAG,VARCHAR2,Yes,Indicates whether items are accrued upon receipt
PO_DISTRIBUTIONS_ALL.SOLDTO_BU_ID,PO_DISTRIBUTIONS_ALL,SOLDTO_BU_ID,NUMBER,Yes,Sold to Business Unit Unique Identifier
PO_DISTRIBUTIONS_ALL.KANBAN_CARD_ID,PO_DISTRIBUTIONS_ALL,KANBAN_CARD_ID,NUMBER,Yes,Primary key for the kanban card. References MTL_KANBAN_CARDS.KANBAN_CARD_ID.
PO_DISTRIBUTIONS_ALL.AWARD_ID,PO_DISTRIBUTIONS_ALL,AWARD_ID,NUMBER,Yes,Award identifier. References GMS_AWARD_DISTRIBUTIONS.AWARD_SET_ID.
PO_DISTRIBUTIONS_ALL.END_ITEM_UNIT_NUMBER,PO_DISTRIBUTIONS_ALL,END_ITEM_UNIT_NUMBER,VARCHAR2,Yes,Project Manufacturing end item unit number
PO_DISTRIBUTIONS_ALL.TAX_RECOVERY_OVERRIDE_FLAG,PO_DISTRIBUTIONS_ALL,TAX_RECOVERY_OVERRIDE_FLAG,VARCHAR2,Yes,Indicator of whether tax recovery should be used
PO_DISTRIBUTIONS_ALL.RECOVERABLE_TAX,PO_DISTRIBUTIONS_ALL,RECOVERABLE_TAX,NUMBER,Yes,The Recoverable exclusive tax amount for the distribution.
PO_DISTRIBUTIONS_ALL.NONRECOVERABLE_TAX,PO_DISTRIBUTIONS_ALL,NONRECOVERABLE_TAX,NUMBER,Yes,The Nonrecoverable exclusive tax amount for the distribution.
PO_DISTRIBUTIONS_ALL.RECOVERABLE_INCLUSIVE_TAX,PO_DISTRIBUTIONS_ALL,RECOVERABLE_INCLUSIVE_TAX,NUMBER,Yes,The portion of the taxes paid that is included in the Distribution Ordered amount and which is recoverable.
PO_DISTRIBUTIONS_ALL.NONRECOVERABLE_INCLUSIVE_TAX,PO_DISTRIBUTIONS_ALL,NONRECOVERABLE_INCLUSIVE_TAX,NUMBER,Yes,The portion of the taxes paid that is included in the Distribution Ordered amount and which is nonrecoverable.
PO_DISTRIBUTIONS_ALL.TAX_EXCLUSIVE_AMOUNT,PO_DISTRIBUTIONS_ALL,TAX_EXCLUSIVE_AMOUNT,NUMBER,Yes,The Purchase order distribution amount that is exclusive of all the taxes.
PO_DISTRIBUTIONS_ALL.RECOVERY_RATE,PO_DISTRIBUTIONS_ALL,RECOVERY_RATE,NUMBER,Yes,Percentage of tax that can be recovered
PO_DISTRIBUTIONS_ALL.OKE_CONTRACT_LINE_ID,PO_DISTRIBUTIONS_ALL,OKE_CONTRACT_LINE_ID,NUMBER,Yes,Line Id associated with a contract. References OKC_K_LINES_B.ID.
PO_DISTRIBUTIONS_ALL.OKE_CONTRACT_DELIVERABLE_ID,PO_DISTRIBUTIONS_ALL,OKE_CONTRACT_DELIVERABLE_ID,NUMBER,Yes,Deliverable Id corresponding to contract. References OKE_K_DELIVERABLES_B.DELIVERABLE_ID.
PO_DISTRIBUTIONS_ALL.AMOUNT_ORDERED,PO_DISTRIBUTIONS_ALL,AMOUNT_ORDERED,NUMBER,Yes,Amount ordered for service lines
PO_DISTRIBUTIONS_ALL.AMOUNT_DELIVERED,PO_DISTRIBUTIONS_ALL,AMOUNT_DELIVERED,NUMBER,Yes,Amount delivered for service lines
PO_DISTRIBUTIONS_ALL.AMOUNT_CANCELLED,PO_DISTRIBUTIONS_ALL,AMOUNT_CANCELLED,NUMBER,Yes,Amount cancelled for service lines
PO_DISTRIBUTIONS_ALL.DISTRIBUTION_TYPE,PO_DISTRIBUTIONS_ALL,DISTRIBUTION_TYPE,VARCHAR2,Yes,#NAME?
PO_DISTRIBUTIONS_ALL.AMOUNT_TO_ENCUMBER,PO_DISTRIBUTIONS_ALL,AMOUNT_TO_ENCUMBER,NUMBER,Yes,#NAME?
PO_DISTRIBUTIONS_ALL.INVOICE_ADJUSTMENT_FLAG,PO_DISTRIBUTIONS_ALL,INVOICE_ADJUSTMENT_FLAG,VARCHAR2,Yes,Flag to indicate invoice adjustment
PO_DISTRIBUTIONS_ALL.DEST_CHARGE_ACCOUNT_ID,PO_DISTRIBUTIONS_ALL,DEST_CHARGE_ACCOUNT_ID,NUMBER,Yes,"Added in Shared Procurement Services Project (FPJ). This is the Charge Account of the Destination OU (DOU), when the DOU is different from the Purchasing OU (POU) and a Transaction Flow exists between the DOU and POU. It is a unique identifier for a General Ledger account and references GL_CODE_COMBINATIONS.code_combination_id."
PO_DISTRIBUTIONS_ALL.DEST_VARIANCE_ACCOUNT_ID,PO_DISTRIBUTIONS_ALL,DEST_VARIANCE_ACCOUNT_ID,NUMBER,Yes,"Added in Shared Procurement Services Project (FPJ). This is the  Variance Account of the DOU, when the DOU is different from the POU and a Transaction Flow exists between the DOU and POU. It is a unique identifier for a General Ledger account and references GL_CODE_COMBINATIONS.code_combination_id."
PO_DISTRIBUTIONS_ALL.QUANTITY_FINANCED,PO_DISTRIBUTIONS_ALL,QUANTITY_FINANCED,NUMBER,Yes,"For Financing Distributions, the number of units which have been pre-paid"
PO_DISTRIBUTIONS_ALL.AMOUNT_FINANCED,PO_DISTRIBUTIONS_ALL,AMOUNT_FINANCED,NUMBER,Yes,"For Advance or Financing Distributions, the amount which has been pre-paid"
PO_DISTRIBUTIONS_ALL.QUANTITY_RECOUPED,PO_DISTRIBUTIONS_ALL,QUANTITY_RECOUPED,NUMBER,Yes,"For Financing Distributions, the number of units for which prepayments have been liquidated"
PO_DISTRIBUTIONS_ALL.AMOUNT_RECOUPED,PO_DISTRIBUTIONS_ALL,AMOUNT_RECOUPED,NUMBER,Yes,"For Advance or Financing Distributions, the amount of the prepayments which has been liquidated"
PO_DISTRIBUTIONS_ALL.RETAINAGE_WITHHELD_AMOUNT,PO_DISTRIBUTIONS_ALL,RETAINAGE_WITHHELD_AMOUNT,NUMBER,Yes,The total amount withheld as Retainage against this Distribution
PO_DISTRIBUTIONS_ALL.RETAINAGE_RELEASED_AMOUNT,PO_DISTRIBUTIONS_ALL,RETAINAGE_RELEASED_AMOUNT,NUMBER,Yes,The amount of Retainage released for this Distribution
PO_DISTRIBUTIONS_ALL.INVOICED_VAL_IN_NTFN,PO_DISTRIBUTIONS_ALL,INVOICED_VAL_IN_NTFN,NUMBER,Yes,Amount or Quantity Billed at the time of sending the Confirm Receipt notification
PO_DISTRIBUTIONS_ALL.INTERFACE_DISTRIBUTION_REF,PO_DISTRIBUTIONS_ALL,INTERFACE_DISTRIBUTION_REF,VARCHAR2,Yes,Interface Distribution Reference
PO_DISTRIBUTIONS_ALL.OBJECT_VERSION_NUMBER,PO_DISTRIBUTIONS_ALL,OBJECT_VERSION_NUMBER,NUMBER,Yes,Used to implement optimistic locking. This number is incremented every time that the row is updated. The number is compared at the start and end of a transaction to detect whether another session has updated the row since it was queried.
PO_DISTRIBUTIONS_ALL.PJC_PROJECT_ID,PO_DISTRIBUTIONS_ALL,PJC_PROJECT_ID,NUMBER,Yes,PJC_PROJECT_ID
PO_DISTRIBUTIONS_ALL.PJC_TASK_ID,PO_DISTRIBUTIONS_ALL,PJC_TASK_ID,NUMBER,Yes,PJC_TASK_ID
PO_DISTRIBUTIONS_ALL.PJC_EXPENDITURE_ITEM_DATE,PO_DISTRIBUTIONS_ALL,PJC_EXPENDITURE_ITEM_DATE,DATE,Yes,PJC_EXPENDITURE_ITEM_DATE
PO_DISTRIBUTIONS_ALL.PJC_ORGANIZATION_ID,PO_DISTRIBUTIONS_ALL,PJC_ORGANIZATION_ID,NUMBER,Yes,PJC_ORGANIZATION_ID
PO_DISTRIBUTIONS_ALL.PJC_EXPENDITURE_TYPE_ID,PO_DISTRIBUTIONS_ALL,PJC_EXPENDITURE_TYPE_ID,NUMBER,Yes,Expenditure type used to build the transaction descriptive flexfield for project-related transaction distributions.
PO_DISTRIBUTIONS_ALL.PJC_CONTEXT_CATEGORY,PO_DISTRIBUTIONS_ALL,PJC_CONTEXT_CATEGORY,VARCHAR2,Yes,Segment used to identify the descriptive flexfield application context for project-related standardized cost collection.
PO_DISTRIBUTIONS_ALL.PJC_BILLABLE_FLAG,PO_DISTRIBUTIONS_ALL,PJC_BILLABLE_FLAG,VARCHAR2,Yes,Flag that indicates if a project-related item is available to be billed to customers.
PO_DISTRIBUTIONS_ALL.PJC_CONTRACT_ID,PO_DISTRIBUTIONS_ALL,PJC_CONTRACT_ID,NUMBER,Yes,Identifier of contract. This attribute is used when Oracle Contract Billing or Oracle Grants Accounting is installed.
PO_DISTRIBUTIONS_ALL.PJC_WORK_TYPE_ID,PO_DISTRIBUTIONS_ALL,PJC_WORK_TYPE_ID,NUMBER,Yes,Identifier for project-related classification of the worked performed.
PO_DISTRIBUTIONS_ALL.PJC_CAPITALIZABLE_FLAG,PO_DISTRIBUTIONS_ALL,PJC_CAPITALIZABLE_FLAG,VARCHAR2,Yes,Flag that indicates if a project-related item is eligible for capitalization.
PO_DISTRIBUTIONS_ALL.PJC_FUNDING_ALLOCATION_ID,PO_DISTRIBUTIONS_ALL,PJC_FUNDING_ALLOCATION_ID,NUMBER,Yes,Specifies the name of the project funding override. This attribute is used when Oracle Contract Billing or Oracle Grants Accounting is installed
PO_DISTRIBUTIONS_ALL.PJC_CONTRACT_LINE_ID,PO_DISTRIBUTIONS_ALL,PJC_CONTRACT_LINE_ID,NUMBER,Yes,Tracks contract line information. This attribute is used when Oracle Contract Billing or Oracle Grants Accounting is installed.
PO_DISTRIBUTIONS_ALL.ORIGINAL_DISTRIBUTION_ID,PO_DISTRIBUTIONS_ALL,ORIGINAL_DISTRIBUTION_ID,NUMBER,Yes,Holds the po_distribution_id of the distribution from which this shipment was copied/split over
PO_DISTRIBUTIONS_ALL.DELIVER_TO_CUST_LOCATION_ID,PO_DISTRIBUTIONS_ALL,DELIVER_TO_CUST_LOCATION_ID,NUMBER,Yes,The final location where goods will be delivered that were previously received from a supplier.
PO_DISTRIBUTIONS_ALL.DELIVER_TO_CUST_ID,PO_DISTRIBUTIONS_ALL,DELIVER_TO_CUST_ID,NUMBER,Yes,Customer to whom merchandise is being delivered.
PO_DISTRIBUTIONS_ALL.DELIVER_TO_CUST_CONTACT_ID,PO_DISTRIBUTIONS_ALL,DELIVER_TO_CUST_CONTACT_ID,NUMBER,Yes,Contact from the company where the good are being delivered.
PO_DISTRIBUTIONS_ALL.SHIPPING_UOM_QTY_DELIVERED,PO_DISTRIBUTIONS_ALL,SHIPPING_UOM_QTY_DELIVERED,NUMBER,Yes,Quantity in shipping unit of measure delivered against the distribution
PO_DISTRIBUTIONS_ALL.SECONDARY_QUANTITY_DELIVERED,PO_DISTRIBUTIONS_ALL,SECONDARY_QUANTITY_DELIVERED,NUMBER,Yes,Quantity in secondary unit of measure delivered against the distribution
PO_DISTRIBUTIONS_ALL.SHIPPING_UOM_QUANTITY,PO_DISTRIBUTIONS_ALL,SHIPPING_UOM_QUANTITY,NUMBER,Yes,Quantity in shipping unit of measure
PO_DISTRIBUTIONS_ALL.SHIPPING_UOM_QUANTITY_CANCELED,PO_DISTRIBUTIONS_ALL,SHIPPING_UOM_QUANTITY_CANCELED,NUMBER,Yes,Quantity in shipping unit of measure canceled up until today
PO_DISTRIBUTIONS_ALL.po_distributions_all,PO_DISTRIBUTIONS_ALL,po_distributions_all,PO_DISTRIBUTION_ID,Yes,Indexes
PO_DISTRIBUTIONS_ALL.Default,PO_DISTRIBUTIONS_ALL,Default,PO_DISTRIBUTION_ID,Yes,
AP_INVOICES_ALL.INVOICE_ID,AP_INVOICES_ALL,INVOICE_ID,NUMBER,Yes,Unique invoice identifier.
AP_INVOICES_ALL.LAST_UPDATE_DATE,AP_INVOICES_ALL,LAST_UPDATE_DATE,TIMESTAMP,Yes,Who column: indicates the date and time of the last update of the row.
AP_INVOICES_ALL.LAST_UPDATED_BY,AP_INVOICES_ALL,LAST_UPDATED_BY,VARCHAR2,Yes,Who column: indicates the user who last updated the row.
AP_INVOICES_ALL.VENDOR_ID,AP_INVOICES_ALL,VENDOR_ID,NUMBER,Yes,Invoice supplier identifier.
AP_INVOICES_ALL.INVOICE_NUM,AP_INVOICES_ALL,INVOICE_NUM,VARCHAR2,Yes,Unique number for supplier invoice.
AP_INVOICES_ALL.SET_OF_BOOKS_ID,AP_INVOICES_ALL,SET_OF_BOOKS_ID,NUMBER,Yes,Ledger identifier of the invoice.
AP_INVOICES_ALL.INVOICE_CURRENCY_CODE,AP_INVOICES_ALL,INVOICE_CURRENCY_CODE,VARCHAR2,Yes,Currency code used on the invoice.
AP_INVOICES_ALL.PAYMENT_CURRENCY_CODE,AP_INVOICES_ALL,PAYMENT_CURRENCY_CODE,VARCHAR2,Yes,Currency code of payment (must be same as INVOICE_CURRENCY_CODE or have a fixed rate relationship)
AP_INVOICES_ALL.PAYMENT_CROSS_RATE,AP_INVOICES_ALL,PAYMENT_CROSS_RATE,NUMBER,Yes,Exchange rate between invoice and payment; in Release 11 the value is always 1 unless they are associated fixed-rate currencies
AP_INVOICES_ALL.INVOICE_AMOUNT,AP_INVOICES_ALL,INVOICE_AMOUNT,NUMBER,Yes,Invoice amount in transaction currency.
AP_INVOICES_ALL.VENDOR_SITE_ID,AP_INVOICES_ALL,VENDOR_SITE_ID,NUMBER,Yes,Physical location of the supplier.
AP_INVOICES_ALL.AMOUNT_PAID,AP_INVOICES_ALL,AMOUNT_PAID,NUMBER,Yes,Amount paid against an invoice.
AP_INVOICES_ALL.DISCOUNT_AMOUNT_TAKEN,AP_INVOICES_ALL,DISCOUNT_AMOUNT_TAKEN,NUMBER,Yes,Discount amount on an invoice.
AP_INVOICES_ALL.INVOICE_DATE,AP_INVOICES_ALL,INVOICE_DATE,DATE,Yes,Date when an event will occur or occurred.
AP_INVOICES_ALL.SOURCE,AP_INVOICES_ALL,SOURCE,VARCHAR2,Yes,Feeder system from which an invoice is imported.
AP_INVOICES_ALL.INVOICE_TYPE_LOOKUP_CODE,AP_INVOICES_ALL,INVOICE_TYPE_LOOKUP_CODE,VARCHAR2,Yes,"Invoice category, such as standard, credit memo, or prepayment."
AP_INVOICES_ALL.DESCRIPTION,AP_INVOICES_ALL,DESCRIPTION,VARCHAR2,Yes,Statement that describes the invoice.
AP_INVOICES_ALL.BATCH_ID,AP_INVOICES_ALL,BATCH_ID,NUMBER,Yes,Unique invoice group identifier.
AP_INVOICES_ALL.AMOUNT_APPLICABLE_TO_DISCOUNT,AP_INVOICES_ALL,AMOUNT_APPLICABLE_TO_DISCOUNT,NUMBER,Yes,Amount of invoice applicable to a discount
AP_INVOICES_ALL.TERMS_ID,AP_INVOICES_ALL,TERMS_ID,NUMBER,Yes,Payment terms identifier used on the invoice.
AP_INVOICES_ALL.TERMS_DATE,AP_INVOICES_ALL,TERMS_DATE,DATE,Yes,Date used with payment terms to calculate scheduled payment of an invoice
AP_INVOICES_ALL.PAYMENT_METHOD_LOOKUP_CODE,AP_INVOICES_ALL,PAYMENT_METHOD_LOOKUP_CODE,VARCHAR2,Yes,Indicates the payment method of the invoice.
AP_INVOICES_ALL.PAY_GROUP_LOOKUP_CODE,AP_INVOICES_ALL,PAY_GROUP_LOOKUP_CODE,VARCHAR2,Yes,"Groups a category of suppliers or invoices for single pay run. For example, employees, merchandise, nonmerchandise, government, domestic, and international."
AP_INVOICES_ALL.ACCTS_PAY_CODE_COMBINATION_ID,AP_INVOICES_ALL,ACCTS_PAY_CODE_COMBINATION_ID,NUMBER,Yes,Accounting Flexfield identifier for accounts payable liability account
AP_INVOICES_ALL.PAYMENT_STATUS_FLAG,AP_INVOICES_ALL,PAYMENT_STATUS_FLAG,VARCHAR2,Yes,"Flag that indicates if invoice has been paid (Y, N, or P)"
AP_INVOICES_ALL.CREATION_DATE,AP_INVOICES_ALL,CREATION_DATE,TIMESTAMP,Yes,Who column: indicates the date and time of the creation of the row.
AP_INVOICES_ALL.CREATED_BY,AP_INVOICES_ALL,CREATED_BY,VARCHAR2,Yes,Who column: indicates the user who created the row.
AP_INVOICES_ALL.BASE_AMOUNT,AP_INVOICES_ALL,BASE_AMOUNT,NUMBER,Yes,"When the Calculate User Exchange Rate option is enabled and when the exchange rate type is User, the user can enter a value for BASE_AMOUNT so the system can calculate the exchange rate."
AP_INVOICES_ALL.LAST_UPDATE_LOGIN,AP_INVOICES_ALL,LAST_UPDATE_LOGIN,VARCHAR2,Yes,Who column: indicates the session login associated to the user who last updated the row.
AP_INVOICES_ALL.EXCLUSIVE_PAYMENT_FLAG,AP_INVOICES_ALL,EXCLUSIVE_PAYMENT_FLAG,VARCHAR2,Yes,Pay invoice on separate payment document flag
AP_INVOICES_ALL.PO_HEADER_ID,AP_INVOICES_ALL,PO_HEADER_ID,NUMBER,Yes,the PO number the invoice is matched to.
AP_INVOICES_ALL.FREIGHT_AMOUNT,AP_INVOICES_ALL,FREIGHT_AMOUNT,NUMBER,Yes,Total freight amount for an invoice.
AP_INVOICES_ALL.GOODS_RECEIVED_DATE,AP_INVOICES_ALL,GOODS_RECEIVED_DATE,DATE,Yes,Date when goods on the invoice were received.
AP_INVOICES_ALL.INVOICE_RECEIVED_DATE,AP_INVOICES_ALL,INVOICE_RECEIVED_DATE,DATE,Yes,Date when the invoice was received. This is used to calculate when the invoice is due.
AP_INVOICES_ALL.VOUCHER_NUM,AP_INVOICES_ALL,VOUCHER_NUM,VARCHAR2,Yes,Voucher number; validated (Sequential Numbering enabled) or non-validated (Sequential Numbering not enabled)
AP_INVOICES_ALL.APPROVED_AMOUNT,AP_INVOICES_ALL,APPROVED_AMOUNT,NUMBER,Yes,Invoice amount approved through manual authorization for payment (used for reference purposes only).
AP_INVOICES_ALL.RECURRING_PAYMENT_ID,AP_INVOICES_ALL,RECURRING_PAYMENT_ID,NUMBER,Yes,Recurring invoice identifier.
AP_INVOICES_ALL.EARLIEST_SETTLEMENT_DATE,AP_INVOICES_ALL,EARLIEST_SETTLEMENT_DATE,DATE,Yes,Date associated with a prepayment after which you can apply the prepayment against invoices.  Only used for temporary prepayments.  Column is null for permanent prepayments and other invoice types
AP_INVOICES_ALL.DOC_SEQUENCE_ID,AP_INVOICES_ALL,DOC_SEQUENCE_ID,NUMBER,Yes,Sequential Numbering (voucher number) document sequence identifier
AP_INVOICES_ALL.DOC_SEQUENCE_VALUE,AP_INVOICES_ALL,DOC_SEQUENCE_VALUE,NUMBER,Yes,Voucher number (Sequential Numbering) for invoice
AP_INVOICES_ALL.DOC_CATEGORY_CODE,AP_INVOICES_ALL,DOC_CATEGORY_CODE,VARCHAR2,Yes,Sequential Numbering (voucher number) document category
AP_INVOICES_ALL.APPROVAL_STATUS,AP_INVOICES_ALL,APPROVAL_STATUS,VARCHAR2,Yes,Status of manual authorization invoice approval (used for reference purposes only).
AP_INVOICES_ALL.APPROVAL_DESCRIPTION,AP_INVOICES_ALL,APPROVAL_DESCRIPTION,VARCHAR2,Yes,Description of manual authorization invoice approval (used for reference purposes only).
AP_INVOICES_ALL.POSTING_STATUS,AP_INVOICES_ALL,POSTING_STATUS,VARCHAR2,Yes,"Status that indicates if invoice can be posted (either Available or N - column is populated, but not used)"
AP_INVOICES_ALL.CANCELLED_DATE,AP_INVOICES_ALL,CANCELLED_DATE,DATE,Yes,Date when the invoice was canceled.
AP_INVOICES_ALL.CANCELLED_BY,AP_INVOICES_ALL,CANCELLED_BY,VARCHAR2,Yes,User ID of person who canceled an invoice.
AP_INVOICES_ALL.CANCELLED_AMOUNT,AP_INVOICES_ALL,CANCELLED_AMOUNT,NUMBER,Yes,Original amount of canceled invoice.
AP_INVOICES_ALL.TEMP_CANCELLED_AMOUNT,AP_INVOICES_ALL,TEMP_CANCELLED_AMOUNT,NUMBER,Yes,Column for recording the original amount of an invoice until cancellation completes successfully
AP_INVOICES_ALL.USSGL_TRANSACTION_CODE,AP_INVOICES_ALL,USSGL_TRANSACTION_CODE,VARCHAR2,Yes,Default transaction code for creating US Standard General Ledger journal entries (Oracle Public Sector Payables)
AP_INVOICES_ALL.USSGL_TRX_CODE_CONTEXT,AP_INVOICES_ALL,USSGL_TRX_CODE_CONTEXT,VARCHAR2,Yes,USSGL Transaction Code Descriptive Flexfield context column
AP_INVOICES_ALL.PROJECT_ID,AP_INVOICES_ALL,PROJECT_ID,NUMBER,Yes,Identifier for project used to build default Accounting Flexfield
AP_INVOICES_ALL.TASK_ID,AP_INVOICES_ALL,TASK_ID,NUMBER,Yes,Identifier for project task used to build default Accounting Flexfield
AP_INVOICES_ALL.EXPENDITURE_TYPE,AP_INVOICES_ALL,EXPENDITURE_TYPE,VARCHAR2,Yes,Project expenditure type used to build default Accounting Flexfield
AP_INVOICES_ALL.EXPENDITURE_ITEM_DATE,AP_INVOICES_ALL,EXPENDITURE_ITEM_DATE,DATE,Yes,Project expenditure item date used to build default Accounting Flexfield
AP_INVOICES_ALL.PA_QUANTITY,AP_INVOICES_ALL,PA_QUANTITY,NUMBER,Yes,Project item quantity used to build default Accounting Flexfield
AP_INVOICES_ALL.EXPENDITURE_ORGANIZATION_ID,AP_INVOICES_ALL,EXPENDITURE_ORGANIZATION_ID,NUMBER,Yes,Identifier for project organization used to build default Accounting Flexfield
AP_INVOICES_ALL.PA_DEFAULT_DIST_CCID,AP_INVOICES_ALL,PA_DEFAULT_DIST_CCID,NUMBER,Yes,Identifier for project-related invoice default Accounting Flexfield (defaults to invoice distribution lines)
AP_INVOICES_ALL.PAYMENT_AMOUNT_TOTAL,AP_INVOICES_ALL,PAYMENT_AMOUNT_TOTAL,NUMBER,Yes,Amount of invoice that has been paid
AP_INVOICES_ALL.AWT_FLAG,AP_INVOICES_ALL,AWT_FLAG,VARCHAR2,Yes,"Flag to indicate if Automatic Withholding Tax has been calculated automatically (A), or manually (M)"
AP_INVOICES_ALL.AWT_GROUP_ID,AP_INVOICES_ALL,AWT_GROUP_ID,NUMBER,Yes,Withholding tax group identifier
AP_INVOICES_ALL.REFERENCE_1,AP_INVOICES_ALL,REFERENCE_1,VARCHAR2,Yes,Reference information from Oracle Projects expense reports
AP_INVOICES_ALL.REFERENCE_2,AP_INVOICES_ALL,REFERENCE_2,VARCHAR2,Yes,Reference information from Oracle Projects expense reports
AP_INVOICES_ALL.ORG_ID,AP_INVOICES_ALL,ORG_ID,NUMBER,Yes,Indicates the identifier of the business unit associated to the row.
AP_INVOICES_ALL.PRE_WITHHOLDING_AMOUNT,AP_INVOICES_ALL,PRE_WITHHOLDING_AMOUNT,NUMBER,Yes,Reserved for future use
AP_INVOICES_ALL.PAYMENT_CROSS_RATE_TYPE,AP_INVOICES_ALL,PAYMENT_CROSS_RATE_TYPE,VARCHAR2,Yes,Cross currency payment rate type (only valid value in this release is EMU Fixed)
AP_INVOICES_ALL.PAYMENT_CROSS_RATE_DATE,AP_INVOICES_ALL,PAYMENT_CROSS_RATE_DATE,DATE,Yes,Cross currency payment rate date
AP_INVOICES_ALL.PAY_CURR_INVOICE_AMOUNT,AP_INVOICES_ALL,PAY_CURR_INVOICE_AMOUNT,NUMBER,Yes,Invoice amount in the payment currency
AP_INVOICES_ALL.MRC_BASE_AMOUNT,AP_INVOICES_ALL,MRC_BASE_AMOUNT,VARCHAR2,Yes,Multiple Reporting Currencies only: Concatenated string of reporting set of books ID and invoice amount in the reporting currency pairs
AP_INVOICES_ALL.MRC_EXCHANGE_RATE,AP_INVOICES_ALL,MRC_EXCHANGE_RATE,VARCHAR2,Yes,Multiple Reporting Currencies only: Concatenated string of reporting set of books ID and currency conversion rate pairs
AP_INVOICES_ALL.MRC_EXCHANGE_RATE_TYPE,AP_INVOICES_ALL,MRC_EXCHANGE_RATE_TYPE,VARCHAR2,Yes,Multiple Reporting Currencies only: Concatenated string of reporting set of books ID and currency conversion rate type pairs
AP_INVOICES_ALL.MRC_EXCHANGE_DATE,AP_INVOICES_ALL,MRC_EXCHANGE_DATE,VARCHAR2,Yes,Multiple Reporting Currencies only: Concatenated string of reporting set of books ID and currency conversion date pairs
AP_INVOICES_ALL.MRC_POSTING_STATUS,AP_INVOICES_ALL,MRC_POSTING_STATUS,VARCHAR2,Yes,Multiple Reporting Currencies only: Concatenated string of reporting set of books ID
AP_INVOICES_ALL.GL_DATE,AP_INVOICES_ALL,GL_DATE,DATE,Yes,Accounting date to default to invoice distributions
AP_INVOICES_ALL.AWARD_ID,AP_INVOICES_ALL,AWARD_ID,NUMBER,Yes,"If Oracle Grants Accounting is installed, the award ID is used with data in project columns to track grant information"
AP_INVOICES_ALL.PAID_ON_BEHALF_EMPLOYEE_ID,AP_INVOICES_ALL,PAID_ON_BEHALF_EMPLOYEE_ID,NUMBER,Yes,"When an expense report gets split in Both Pay scenario, the new expense report's paid_on_behalf_employee_id gets populated with the original expense report's employee_id."
AP_INVOICES_ALL.AMT_DUE_CCARD_COMPANY,AP_INVOICES_ALL,AMT_DUE_CCARD_COMPANY,NUMBER,Yes,Amount that is due to credit card company
AP_INVOICES_ALL.AMT_DUE_EMPLOYEE,AP_INVOICES_ALL,AMT_DUE_EMPLOYEE,NUMBER,Yes,Amount that is due to an employee.
AP_INVOICES_ALL.APPROVAL_READY_FLAG,AP_INVOICES_ALL,APPROVAL_READY_FLAG,VARCHAR2,Yes,Indicates whether invoice is ready for the Invoice Approval Workflow process (Y or N)
AP_INVOICES_ALL.APPROVAL_ITERATION,AP_INVOICES_ALL,APPROVAL_ITERATION,NUMBER,Yes,Count of times invoice has passed through the Invoice Approval Workflow process
AP_INVOICES_ALL.WFAPPROVAL_STATUS,AP_INVOICES_ALL,WFAPPROVAL_STATUS,VARCHAR2,Yes,Status of invoice in the Invoice Approval Workflow process
AP_INVOICES_ALL.REQUESTER_ID,AP_INVOICES_ALL,REQUESTER_ID,NUMBER,Yes,Requester of invoice is used by the Invoice Approval Workflow process to generate the list of approvers
AP_INVOICES_ALL.VALIDATION_REQUEST_ID,AP_INVOICES_ALL,VALIDATION_REQUEST_ID,NUMBER,Yes,Identifier for the invoice validation concurrent request that is currently processing the invoice.
AP_INVOICES_ALL.VALIDATED_TAX_AMOUNT,AP_INVOICES_ALL,VALIDATED_TAX_AMOUNT,NUMBER,Yes,Total tax amount excluded from the discountable amount
AP_INVOICES_ALL.QUICK_CREDIT,AP_INVOICES_ALL,QUICK_CREDIT,VARCHAR2,Yes,Indicates whether a Credit or Debit Memo was created as a Quick Credit
AP_INVOICES_ALL.CREDITED_INVOICE_ID,AP_INVOICES_ALL,CREDITED_INVOICE_ID,NUMBER,Yes,Identifier for invoice to be fully reversed by a Credit or Debit Memo
